12:25:03.874177 IP 127.0.0.1.59423 > 127.0.1.1.53: 54426+ A? www.mozilla.org. (33)
12:25:03.874188 IP 127.0.0.1.59423 > 127.0.1.1.53: 27936+ AAAA? www.mozilla.org. (33)
12:25:03.874228 IP 10.0.2.15.36361 > 192.168.1.1.53: 15249+ A? www.mozilla.org. (33)
12:25:03.874309 IP 10.0.2.15.36361 > 192.168.0.1.53: 15249+ A? www.mozilla.org. (33)
12:25:03.874363 IP 10.0.2.15.59821 > 192.168.0.1.53: 23118+ AAAA? www.mozilla.org. (33)
12:25:03.893812 IP 192.168.0.1.53 > 10.0.2.15.59821: 23118 3/0/0 CNAME www.mozilla.org.cdn.cloudflare.net., AAAA 2606:4700::6810:2802, AAAA 2606:4700::6810:2902 (137)
12:25:03.893825 IP 192.168.0.1.53 > 10.0.2.15.36361: 15249 3/0/0 CNAME www.mozilla.org.cdn.cloudflare.net., A 104.16.40.2, A 104.16.41.2 (113)
12:25:03.894571 IP 127.0.1.1.53 > 127.0.0.1.59423: 54426 3/0/0 CNAME www.mozilla.org.cdn.cloudflare.net., A 104.16.40.2, A 104.16.41.2 (113)
12:25:03.894591 IP 127.0.1.1.53 > 127.0.0.1.59423: 27936 3/0/0 CNAME www.mozilla.org.cdn.cloudflare.net., AAAA 2606:4700::6810:2802, AAAA 2606:4700::6810:2902 (137)
12:25:03.897805 IP 192.168.1.1.53 > 10.0.2.15.36361: 15249 3/0/0 CNAME www.mozilla.org.cdn.cloudflare.net., A 104.16.41.2, A 104.16.40.2 (113)
12:25:03.897824 IP 10.0.2.15 > 192.168.1.1: ICMP 10.0.2.15 udp port 36361 unreachable, length 149
12:25:05.632826 IP 127.0.0.1.59087 > 127.0.1.1.53: 30288+ A? www.google.com. (32)
12:25:05.632836 IP 127.0.0.1.59087 > 127.0.1.1.53: 42887+ AAAA? www.google.com. (32)
12:25:05.632907 IP 10.0.2.15.45189 > 192.168.0.1.53: 32588+ A? www.google.com. (32)
12:25:05.633000 IP 10.0.2.15.17477 > 192.168.0.1.53: 53755+ AAAA? www.google.com. (32)
12:25:05.652432 IP 192.168.0.1.53 > 10.0.2.15.17477: 53755 1/0/0 AAAA 2404:6800:4008:801::2004 (60)
12:25:05.652499 IP 127.0.1.1.53 > 127.0.0.1.59087: 42887 1/0/0 AAAA 2404:6800:4008:801::2004 (60)
12:25:05.659008 IP 192.168.0.1.53 > 10.0.2.15.45189: 32588 1/0/0 A 69.171.245.53 (48)
12:25:05.659163 IP 127.0.1.1.53 > 127.0.0.1.59087: 30288 1/0/0 A 69.171.245.53 (48)
12:25:05.659692 IP 10.0.2.15.60522 > 69.171.245.53.443: Flags [S], seq 498341899, win 29200, options [mss 1460,sackOK,TS val 6395801 ecr 0,nop,wscale 7], length 0
12:25:05.910945 IP 10.0.2.15.60524 > 69.171.245.53.443: Flags [S], seq 2911818185, win 29200, options [mss 1460,sackOK,TS val 6395864 ecr 0,nop,wscale 7], length 0
12:25:06.657421 IP 10.0.2.15.60522 > 69.171.245.53.443: Flags [S], seq 498341899, win 29200, options [mss 1460,sackOK,TS val 6396051 ecr 0,nop,wscale 7], length 0
12:25:06.909126 IP 10.0.2.15.60524 > 69.171.245.53.443: Flags [S], seq 2911818185, win 29200, options [mss 1460,sackOK,TS val 6396114 ecr 0,nop,wscale 7], length 0
12:25:08.661361 IP 10.0.2.15.60522 > 69.171.245.53.443: Flags [S], seq 498341899, win 29200, options [mss 1460,sackOK,TS val 6396552 ecr 0,nop,wscale 7], length 0
12:25:08.913894 IP 10.0.2.15.60524 > 69.171.245.53.443: Flags [S], seq 2911818185, win 29200, options [mss 1460,sackOK,TS val 6396615 ecr 0,nop,wscale 7], length 0
12:25:09.353451 IP 127.0.0.1.41217 > 127.0.1.1.53: 42465+ A? self-repair.mozilla.org. (41)
12:25:09.353490 IP 10.0.2.15.12974 > 192.168.0.1.53: 38770+ A? self-repair.mozilla.org. (41)
12:25:09.353591 IP 127.0.0.1.41217 > 127.0.1.1.53: 4419+ AAAA? self-repair.mozilla.org. (41)
12:25:09.353619 IP 10.0.2.15.53832 > 192.168.0.1.53: 16983+ AAAA? self-repair.mozilla.org. (41)
12:25:09.370404 IP 192.168.0.1.53 > 10.0.2.15.12974: 38770 6/0/0 CNAME self-repair.r53-2.services.mozilla.com., CNAME d39fl7ga3npck8.cloudfront.net., A 52.84.49.4, A 52.84.49.151, A 52.84.49.184, A 52.84.49.139 (200)
12:25:09.370483 IP 127.0.1.1.53 > 127.0.0.1.41217: 42465 6/0/0 CNAME self-repair.r53-2.services.mozilla.com., CNAME d39fl7ga3npck8.cloudfront.net., A 52.84.49.4, A 52.84.49.151, A 52.84.49.184, A 52.84.49.139 (200)
12:25:09.372999 IP 192.168.0.1.53 > 10.0.2.15.53832: 16983 10/0/0 CNAME self-repair.r53-2.services.mozilla.com., CNAME d39fl7ga3npck8.cloudfront.net., AAAA 2600:9000:204b:ec00:13:9d43:b600:93a1, AAAA 2600:9000:204b:a200:13:9d43:b600:93a1, AAAA 2600:9000:204b:6c00:13:9d43:b600:93a1, AAAA 2600:9000:204b:9000:13:9d43:b600:93a1, AAAA 2600:9000:204b:6200:13:9d43:b600:93a1, AAAA 2600:9000:204b:400:13:9d43:b600:93a1, AAAA 2600:9000:204b:3000:13:9d43:b600:93a1, AAAA 2600:9000:204b:0:13:9d43:b600:93a1 (360)
12:25:09.373066 IP 127.0.1.1.53 > 127.0.0.1.41217: 4419 10/0/0 CNAME self-repair.r53-2.services.mozilla.com., CNAME d39fl7ga3npck8.cloudfront.net., AAAA 2600:9000:204b:ec00:13:9d43:b600:93a1, AAAA 2600:9000:204b:a200:13:9d43:b600:93a1, AAAA 2600:9000:204b:6c00:13:9d43:b600:93a1, AAAA 2600:9000:204b:9000:13:9d43:b600:93a1, AAAA 2600:9000:204b:6200:13:9d43:b600:93a1, AAAA 2600:9000:204b:400:13:9d43:b600:93a1, AAAA 2600:9000:204b:3000:13:9d43:b600:93a1, AAAA 2600:9000:204b:0:13:9d43:b600:93a1 (360)
12:25:09.373379 IP 10.0.2.15.41740 > 52.84.49.4.443: Flags [S], seq 2045991963, win 29200, options [mss 1460,sackOK,TS val 6396730 ecr 0,nop,wscale 7], length 0
12:25:09.482305 IP 52.84.49.4.443 > 10.0.2.15.41740: Flags [S.], seq 424384001, ack 2045991964, win 65535, options [mss 1460], length 0
12:25:09.482352 IP 10.0.2.15.41740 > 52.84.49.4.443: Flags [.], ack 1, win 29200, length 0
12:25:09.483381 IP 10.0.2.15.41740 > 52.84.49.4.443: Flags [P.], seq 1:198, ack 1, win 29200, length 197
12:25:09.483859 IP 52.84.49.4.443 > 10.0.2.15.41740: Flags [.], ack 198, win 65535, length 0
12:25:09.586601 IP 52.84.49.4.443 > 10.0.2.15.41740: Flags [.], seq 1:2841, ack 198, win 65535, length 2840
12:25:09.586626 IP 10.0.2.15.41740 > 52.84.49.4.443: Flags [.], ack 2841, win 34080, length 0
12:25:09.587064 IP 52.84.49.4.443 > 10.0.2.15.41740: Flags [P.], seq 2841:3852, ack 198, win 65535, length 1011
12:25:09.587080 IP 10.0.2.15.41740 > 52.84.49.4.443: Flags [.], ack 3852, win 36920, length 0
12:25:09.606529 IP 10.0.2.15.41740 > 52.84.49.4.443: Flags [P.], seq 198:324, ack 3852, win 36920, length 126
12:25:09.607020 IP 52.84.49.4.443 > 10.0.2.15.41740: Flags [.], ack 324, win 65535, length 0
12:25:09.608033 IP 10.0.2.15.41740 > 52.84.49.4.443: Flags [P.], seq 324:481, ack 3852, win 36920, length 157
12:25:09.608633 IP 52.84.49.4.443 > 10.0.2.15.41740: Flags [.], ack 481, win 65535, length 0
12:25:09.687992 IP 52.84.49.4.443 > 10.0.2.15.41740: Flags [P.], seq 3852:4201, ack 481, win 65535, length 349
12:25:09.688890 IP 10.0.2.15.41740 > 52.84.49.4.443: Flags [P.], seq 481:519, ack 4201, win 39760, length 38
12:25:09.689378 IP 52.84.49.4.443 > 10.0.2.15.41740: Flags [.], ack 519, win 65535, length 0
12:25:12.669667 IP 10.0.2.15.60522 > 69.171.245.53.443: Flags [S], seq 498341899, win 29200, options [mss 1460,sackOK,TS val 6397554 ecr 0,nop,wscale 7], length 0
12:25:12.917241 IP 10.0.2.15.60524 > 69.171.245.53.443: Flags [S], seq 2911818185, win 29200, options [mss 1460,sackOK,TS val 6397616 ecr 0,nop,wscale 7], length 0
12:25:20.693505 IP 10.0.2.15.60522 > 69.171.245.53.443: Flags [S], seq 498341899, win 29200, options [mss 1460,sackOK,TS val 6399560 ecr 0,nop,wscale 7], length 0
12:25:20.934354 IP 10.0.2.15.60524 > 69.171.245.53.443: Flags [S], seq 2911818185, win 29200, options [mss 1460,sackOK,TS val 6399620 ecr 0,nop,wscale 7], length 0
12:25:36.726457 IP 10.0.2.15.60522 > 69.171.245.53.443: Flags [S], seq 498341899, win 29200, options [mss 1460,sackOK,TS val 6403568 ecr 0,nop,wscale 7], length 0
12:25:36.981962 IP 10.0.2.15.60524 > 69.171.245.53.443: Flags [S], seq 2911818185, win 29200, options [mss 1460,sackOK,TS val 6403632 ecr 0,nop,wscale 7], length 0
12:25:46.484410 IP 127.0.0.1.35653 > 127.0.1.1.53: 18555+ A? tiles.services.mozilla.com. (44)
12:25:46.484445 IP 10.0.2.15.15695 > 192.168.1.1.53: 60158+ A? tiles.services.mozilla.com. (44)
12:25:46.484524 IP 10.0.2.15.15695 > 192.168.0.1.53: 60158+ A? tiles.services.mozilla.com. (44)
12:25:46.484754 IP 127.0.0.1.35653 > 127.0.1.1.53: 60857+ AAAA? tiles.services.mozilla.com. (44)
12:25:46.484772 IP 10.0.2.15.45267 > 192.168.0.1.53: 56+ AAAA? tiles.services.mozilla.com. (44)
12:25:46.507252 IP 192.168.0.1.53 > 10.0.2.15.45267: 56 1/0/0 CNAME tiles.r53-2.services.mozilla.com. (70)
12:25:46.507277 IP 192.168.1.1.53 > 10.0.2.15.15695: 60158 9/0/0 CNAME tiles.r53-2.services.mozilla.com., A 52.39.131.77, A 52.34.107.172, A 52.41.78.152, A 52.43.91.152, A 54.187.46.234, A 52.26.103.165, A 52.43.40.243, A 54.186.163.246 (198)
12:25:46.507283 IP 192.168.0.1.53 > 10.0.2.15.15695: 60158 9/0/0 CNAME tiles.r53-2.services.mozilla.com., A 52.43.40.243, A 52.34.107.172, A 54.187.46.234, A 52.26.103.165, A 52.43.91.152, A 52.39.131.77, A 54.186.163.246, A 52.41.78.152 (198)
12:25:46.507472 IP 127.0.1.1.53 > 127.0.0.1.35653: 18555 9/0/0 CNAME tiles.r53-2.services.mozilla.com., A 52.39.131.77, A 52.34.107.172, A 52.41.78.152, A 52.43.91.152, A 54.187.46.234, A 52.26.103.165, A 52.43.40.243, A 54.186.163.246 (198)
12:25:46.507526 IP 127.0.1.1.53 > 127.0.0.1.35653: 60857 1/0/0 CNAME tiles.r53-2.services.mozilla.com. (70)
12:25:46.511796 IP 10.0.2.15.42452 > 52.39.131.77.443: Flags [S], seq 1618349822, win 29200, options [mss 1460,sackOK,TS val 6406014 ecr 0,nop,wscale 7], length 0
12:25:46.762196 IP 10.0.2.15.42454 > 52.39.131.77.443: Flags [S], seq 3990440522, win 29200, options [mss 1460,sackOK,TS val 6406077 ecr 0,nop,wscale 7], length 0
12:25:46.860851 IP 52.39.131.77.443 > 10.0.2.15.42452: Flags [S.], seq 429056001, ack 1618349823, win 65535, options [mss 1460], length 0
12:25:46.860874 IP 10.0.2.15.42452 > 52.39.131.77.443: Flags [.], ack 1, win 29200, length 0
12:25:46.861135 IP 10.0.2.15.42452 > 52.39.131.77.443: Flags [P.], seq 1:201, ack 1, win 29200, length 200
12:25:46.861270 IP 52.39.131.77.443 > 10.0.2.15.42452: Flags [.], ack 201, win 65535, length 0
12:25:47.063119 IP 52.39.131.77.443 > 10.0.2.15.42454: Flags [S.], seq 429184001, ack 3990440523, win 65535, options [mss 1460], length 0
12:25:47.063142 IP 10.0.2.15.42454 > 52.39.131.77.443: Flags [.], ack 1, win 29200, length 0
12:25:47.063405 IP 10.0.2.15.42454 > 52.39.131.77.443: Flags [P.], seq 1:201, ack 1, win 29200, length 200
12:25:47.063632 IP 52.39.131.77.443 > 10.0.2.15.42454: Flags [.], ack 201, win 65535, length 0
12:25:47.267198 IP 52.39.131.77.443 > 10.0.2.15.42452: Flags [.], seq 1:2841, ack 201, win 65535, length 2840
12:25:47.267210 IP 10.0.2.15.42452 > 52.39.131.77.443: Flags [.], ack 2841, win 34080, length 0
12:25:47.267412 IP 52.39.131.77.443 > 10.0.2.15.42452: Flags [P.], seq 2841:3015, ack 201, win 65535, length 174
12:25:47.267417 IP 10.0.2.15.42452 > 52.39.131.77.443: Flags [.], ack 3015, win 36920, length 0
12:25:47.269485 IP 10.0.2.15.42452 > 52.39.131.77.443: Flags [P.], seq 201:327, ack 3015, win 36920, length 126
12:25:47.269660 IP 52.39.131.77.443 > 10.0.2.15.42452: Flags [.], ack 327, win 65535, length 0
12:25:47.270474 IP 127.0.0.1.41240 > 127.0.1.1.53: 63545+ A? ocsp.digicert.com. (35)
12:25:47.270503 IP 10.0.2.15.42225 > 192.168.0.1.53: 36666+ A? ocsp.digicert.com. (35)
12:25:47.270607 IP 127.0.0.1.41240 > 127.0.1.1.53: 9665+ AAAA? ocsp.digicert.com. (35)
12:25:47.270624 IP 10.0.2.15.65458 > 192.168.0.1.53: 27844+ AAAA? ocsp.digicert.com. (35)
12:25:47.283600 IP 192.168.0.1.53 > 10.0.2.15.42225: 36666 2/0/0 CNAME cs9.wac.phicdn.net., A 117.18.237.29 (83)
12:25:47.283671 IP 127.0.1.1.53 > 127.0.0.1.41240: 63545 2/0/0 CNAME cs9.wac.phicdn.net., A 117.18.237.29 (83)
12:25:47.286211 IP 192.168.0.1.53 > 10.0.2.15.65458: 27844 1/0/0 CNAME cs9.wac.phicdn.net. (67)
12:25:47.286247 IP 127.0.1.1.53 > 127.0.0.1.41240: 9665 1/0/0 CNAME cs9.wac.phicdn.net. (67)
12:25:47.286380 IP 10.0.2.15.44528 > 117.18.237.29.80: Flags [S], seq 2661980622, win 29200, options [mss 1460,sackOK,TS val 6406208 ecr 0,nop,wscale 7], length 0
12:25:47.370215 IP 52.39.131.77.443 > 10.0.2.15.42454: Flags [P.], seq 1:2881, ack 201, win 65535, length 2880
12:25:47.370229 IP 10.0.2.15.42454 > 52.39.131.77.443: Flags [.], ack 2881, win 34080, length 0
12:25:47.371454 IP 10.0.2.15.44530 > 117.18.237.29.80: Flags [S], seq 4291681132, win 29200, options [mss 1460,sackOK,TS val 6406229 ecr 0,nop,wscale 7], length 0
12:25:47.378934 IP 117.18.237.29.80 > 10.0.2.15.44528: Flags [S.], seq 429248001, ack 2661980623, win 65535, options [mss 1460], length 0
12:25:47.378996 IP 10.0.2.15.44528 > 117.18.237.29.80: Flags [.], ack 1, win 29200, length 0
12:25:47.379386 IP 10.0.2.15.44528 > 117.18.237.29.80: Flags [P.], seq 1:440, ack 1, win 29200, length 439: HTTP: POST / HTTP/1.1
12:25:47.379774 IP 117.18.237.29.80 > 10.0.2.15.44528: Flags [.], ack 440, win 65535, length 0
12:25:47.379817 IP 10.0.2.15.44532 > 117.18.237.29.80: Flags [S], seq 940529499, win 29200, options [mss 1460,sackOK,TS val 6406231 ecr 0,nop,wscale 7], length 0
12:25:47.577929 IP 117.18.237.29.80 > 10.0.2.15.44532: Flags [S.], seq 429376001, ack 940529500, win 65535, options [mss 1460], length 0
12:25:47.577948 IP 10.0.2.15.44532 > 117.18.237.29.80: Flags [.], ack 1, win 29200, length 0
12:25:47.577977 IP 117.18.237.29.80 > 10.0.2.15.44530: Flags [S.], seq 429440001, ack 4291681133, win 65535, options [mss 1460], length 0
12:25:47.577981 IP 10.0.2.15.44530 > 117.18.237.29.80: Flags [.], ack 1, win 29200, length 0
12:25:47.577998 IP 117.18.237.29.80 > 10.0.2.15.44528: Flags [P.], seq 1:789, ack 440, win 65535, length 788: HTTP: HTTP/1.1 200 OK
12:25:47.578001 IP 10.0.2.15.44528 > 117.18.237.29.80: Flags [.], ack 789, win 30732, length 0
12:25:47.578015 IP 52.39.131.77.443 > 10.0.2.15.42452: Flags [P.], seq 3015:3066, ack 327, win 65535, length 51
12:25:47.578436 IP 10.0.2.15.44528 > 117.18.237.29.80: Flags [P.], seq 440:879, ack 789, win 30732, length 439: HTTP: POST / HTTP/1.1
12:25:47.578610 IP 117.18.237.29.80 > 10.0.2.15.44528: Flags [.], ack 879, win 65535, length 0
12:25:47.588568 IP 10.0.2.15.42452 > 52.39.131.77.443: Flags [P.], seq 327:778, ack 3066, win 36920, length 451
12:25:47.588837 IP 52.39.131.77.443 > 10.0.2.15.42452: Flags [.], ack 778, win 65535, length 0
12:25:47.699155 IP 127.0.0.1.50954 > 127.0.1.1.53: 21405+ A? github.com. (28)
12:25:47.699212 IP 10.0.2.15.4407 > 192.168.0.1.53: 61380+ A? github.com. (28)
12:25:47.699291 IP 127.0.0.1.50954 > 127.0.1.1.53: 18303+ AAAA? github.com. (28)
12:25:47.699307 IP 10.0.2.15.1438 > 192.168.0.1.53: 9724+ AAAA? github.com. (28)
12:25:47.702506 IP 117.18.237.29.80 > 10.0.2.15.44528: Flags [P.], seq 789:1577, ack 879, win 65535, length 788: HTTP: HTTP/1.1 200 OK
12:25:47.716694 IP 192.168.0.1.53 > 10.0.2.15.4407: 61380*- 1/0/0 A 127.0.0.1 (44)
12:25:47.716757 IP 127.0.1.1.53 > 127.0.0.1.50954: 21405* 1/0/0 A 127.0.0.1 (44)
12:25:47.741545 IP 10.0.2.15.44528 > 117.18.237.29.80: Flags [.], ack 1577, win 32308, length 0
12:25:47.983764 IP 52.39.131.77.443 > 10.0.2.15.42452: Flags [P.], seq 3066:3286, ack 778, win 65535, length 220
12:25:48.021653 IP 10.0.2.15.42452 > 52.39.131.77.443: Flags [.], ack 3286, win 39760, length 0
12:25:48.209365 IP 10.0.2.15.42452 > 52.39.131.77.443: Flags [P.], seq 778:1231, ack 3286, win 39760, length 453
12:25:48.209683 IP 52.39.131.77.443 > 10.0.2.15.42452: Flags [.], ack 1231, win 65535, length 0
12:25:48.219263 IP 127.0.0.1.33764 > 127.0.1.1.53: 35100+ A? tiles.services.mozilla.com. (44)
12:25:48.219281 IP 127.0.0.1.33764 > 127.0.1.1.53: 49959+ AAAA? tiles.services.mozilla.com. (44)
12:25:48.219331 IP 10.0.2.15.37515 > 192.168.0.1.53: 10741+ A? tiles.services.mozilla.com. (44)
12:25:48.219437 IP 10.0.2.15.15919 > 192.168.0.1.53: 38354+ AAAA? tiles.services.mozilla.com. (44)
12:25:48.223462 IP 192.168.0.1.53 > 10.0.2.15.37515: 10741 8/0/0 A 52.43.40.243, A 52.34.107.172, A 54.187.46.234, A 52.26.103.165, A 52.43.91.152, A 52.39.131.77, A 54.186.163.246, A 52.41.78.152 (172)
12:25:48.223554 IP 127.0.1.1.53 > 127.0.0.1.33764: 35100 8/0/0 A 52.43.40.243, A 52.34.107.172, A 54.187.46.234, A 52.26.103.165, A 52.43.91.152, A 52.39.131.77, A 54.186.163.246, A 52.41.78.152 (172)
12:25:48.231343 IP 192.168.0.1.53 > 10.0.2.15.15919: 38354 1/0/0 CNAME tiles.r53-2.services.mozilla.com. (70)
12:25:48.231427 IP 127.0.1.1.53 > 127.0.0.1.33764: 49959 1/0/0 CNAME tiles.r53-2.services.mozilla.com. (70)
12:25:48.231785 IP 127.0.0.1.48434 > 127.0.1.1.53: 9179+ A? github.githubassets.com. (41)
12:25:48.231795 IP 127.0.0.1.48434 > 127.0.1.1.53: 28564+ AAAA? github.githubassets.com. (41)
12:25:48.231825 IP 10.0.2.15.36927 > 192.168.0.1.53: 40230+ A? github.githubassets.com. (41)
12:25:48.231898 IP 10.0.2.15.24406 > 192.168.0.1.53: 44987+ AAAA? github.githubassets.com. (41)
12:25:48.248510 IP 192.168.0.1.53 > 10.0.2.15.36927: 40230 4/0/0 A 185.199.109.154, A 185.199.111.154, A 185.199.108.154, A 185.199.110.154 (105)
12:25:48.248613 IP 127.0.1.1.53 > 127.0.0.1.48434: 9179 4/0/0 A 185.199.109.154, A 185.199.111.154, A 185.199.108.154, A 185.199.110.154 (105)
12:25:48.597661 IP 52.39.131.77.443 > 10.0.2.15.42454: Flags [P.], seq 2881:3015, ack 201, win 65535, length 134
12:25:48.597686 IP 10.0.2.15.42454 > 52.39.131.77.443: Flags [.], ack 3015, win 36920, length 0
12:25:48.597754 IP 52.39.131.77.443 > 10.0.2.15.42452: Flags [P.], seq 3286:3506, ack 1231, win 65535, length 220
12:25:48.597762 IP 10.0.2.15.42452 > 52.39.131.77.443: Flags [.], ack 3506, win 42600, length 0
12:25:48.607893 IP 10.0.2.15.42454 > 52.39.131.77.443: Flags [P.], seq 201:327, ack 3015, win 36920, length 126
12:25:48.608269 IP 52.39.131.77.443 > 10.0.2.15.42454: Flags [.], ack 327, win 65535, length 0
12:25:48.906924 IP 52.39.131.77.443 > 10.0.2.15.42454: Flags [P.], seq 3015:3066, ack 327, win 65535, length 51
12:25:48.949454 IP 10.0.2.15.42454 > 52.39.131.77.443: Flags [.], ack 3066, win 36920, length 0
12:25:50.032138 IP 192.168.0.1.53 > 10.0.2.15.1438: 9724 0/0/0 (28)
12:25:50.032233 IP 127.0.1.1.53 > 127.0.0.1.50954: 18303 0/0/0 (28)
12:25:50.032498 IP 127.0.0.1.59522 > 127.0.0.1.443: Flags [S], seq 810608215, win 43690, options [mss 65495,sackOK,TS val 6406894 ecr 0,nop,wscale 7], length 0
12:25:50.032503 IP 127.0.0.1.443 > 127.0.0.1.59522: Flags [R.], seq 0, ack 810608216, win 0, length 0
12:25:50.032720 IP 127.0.0.1.59524 > 127.0.0.1.443: Flags [S], seq 556562821, win 43690, options [mss 65495,sackOK,TS val 6406894 ecr 0,nop,wscale 7], length 0
12:25:50.032722 IP 127.0.0.1.443 > 127.0.0.1.59524: Flags [R.], seq 0, ack 556562822, win 0, length 0
12:25:50.953170 IP 192.168.0.1.53 > 10.0.2.15.24406: 44987 0/0/0 (41)
12:25:50.953355 IP 127.0.1.1.53 > 127.0.0.1.48434: 28564 0/0/0 (41)
12:25:52.862199 IP 10.0.2.15.44530 > 117.18.237.29.80: Flags [F.], seq 1, ack 1, win 29200, length 0
12:25:52.862266 IP 10.0.2.15.44532 > 117.18.237.29.80: Flags [F.], seq 1, ack 1, win 29200, length 0
12:25:52.862324 IP 10.0.2.15.42454 > 52.39.131.77.443: Flags [P.], seq 327:358, ack 3066, win 36920, length 31
12:25:52.862359 IP 10.0.2.15.42454 > 52.39.131.77.443: Flags [F.], seq 358, ack 3066, win 36920, length 0
12:25:52.862436 IP 117.18.237.29.80 > 10.0.2.15.44530: Flags [.], ack 2, win 65535, length 0
12:25:52.862449 IP 117.18.237.29.80 > 10.0.2.15.44532: Flags [.], ack 2, win 65535, length 0
12:25:52.862500 IP 52.39.131.77.443 > 10.0.2.15.42454: Flags [.], ack 358, win 65535, length 0
12:25:52.862504 IP 52.39.131.77.443 > 10.0.2.15.42454: Flags [.], ack 359, win 65535, length 0
12:25:53.002467 IP 117.18.237.29.80 > 10.0.2.15.44532: Flags [F.], seq 1, ack 2, win 65535, length 0
12:25:53.002486 IP 10.0.2.15.44532 > 117.18.237.29.80: Flags [.], ack 2, win 29200, length 0
12:25:53.002514 IP 117.18.237.29.80 > 10.0.2.15.44530: Flags [F.], seq 1, ack 2, win 65535, length 0
12:25:53.002521 IP 10.0.2.15.44530 > 117.18.237.29.80: Flags [.], ack 2, win 29200, length 0
12:25:53.206668 IP 52.39.131.77.443 > 10.0.2.15.42454: Flags [P.], seq 3066:3097, ack 359, win 65535, length 31
12:25:53.206683 IP 10.0.2.15.42454 > 52.39.131.77.443: Flags [R], seq 3990440881, win 0, length 0
12:25:53.206710 IP 52.39.131.77.443 > 10.0.2.15.42454: Flags [F.], seq 3097, ack 359, win 65535, length 0
12:25:53.206713 IP 10.0.2.15.42454 > 52.39.131.77.443: Flags [R], seq 3990440881, win 0, length 0
12:25:53.206876 IP 52.39.131.77.443 > 10.0.2.15.42454: Flags [R.], seq 3865783295, ack 359, win 0, length 0
12:25:57.258180 IP 127.0.0.1.39844 > 127.0.1.1.53: 10643+ A? support.mozilla.org. (37)
12:25:57.258196 IP 127.0.0.1.39844 > 127.0.1.1.53: 16660+ AAAA? support.mozilla.org. (37)
12:25:57.258265 IP 10.0.2.15.53911 > 192.168.0.1.53: 38129+ A? support.mozilla.org. (37)
12:25:57.258401 IP 10.0.2.15.51579 > 192.168.0.1.53: 35370+ AAAA? support.mozilla.org. (37)
12:25:57.275438 IP 192.168.0.1.53 > 10.0.2.15.51579: 35370 2/0/0 CNAME prod.sumo.moz.works., CNAME prod-tp.sumo.moz.works. (92)
12:25:57.275477 IP 192.168.0.1.53 > 10.0.2.15.53911: 38129 4/0/0 CNAME prod.sumo.moz.works., CNAME prod-tp.sumo.moz.works., A 52.39.96.89, A 50.112.160.118 (124)
12:25:57.275641 IP 127.0.1.1.53 > 127.0.0.1.39844: 10643 4/0/0 CNAME prod.sumo.moz.works., CNAME prod-tp.sumo.moz.works., A 52.39.96.89, A 50.112.160.118 (124)
12:25:57.275671 IP 127.0.1.1.53 > 127.0.0.1.39844: 16660 2/0/0 CNAME prod.sumo.moz.works., CNAME prod-tp.sumo.moz.works. (92)
12:25:57.701141 IP 10.0.2.15.44528 > 117.18.237.29.80: Flags [.], ack 1577, win 32308, length 0
12:25:57.701427 IP 117.18.237.29.80 > 10.0.2.15.44528: Flags [.], ack 879, win 65535, length 0
12:25:58.601905 IP 10.0.2.15.42452 > 52.39.131.77.443: Flags [.], ack 3506, win 42600, length 0
12:25:58.602063 IP 52.39.131.77.443 > 10.0.2.15.42452: Flags [.], ack 1231, win 65535, length 0
12:26:01.883513 IP 127.0.0.1.56878 > 127.0.1.1.53: 48566+ A? incoming.telemetry.mozilla.org. (48)
12:26:01.883545 IP 10.0.2.15.6653 > 192.168.0.1.53: 52562+ A? incoming.telemetry.mozilla.org. (48)
12:26:01.883638 IP 127.0.0.1.56878 > 127.0.1.1.53: 14325+ AAAA? incoming.telemetry.mozilla.org. (48)
12:26:01.883654 IP 10.0.2.15.26159 > 192.168.0.1.53: 354+ AAAA? incoming.telemetry.mozilla.org. (48)
12:26:01.902967 IP 192.168.0.1.53 > 10.0.2.15.26159: 354 2/0/0 CNAME telemetry-incoming.r53-2.services.mozilla.com., CNAME pipeline-edge-prod-25-561439127.us-west-2.elb.amazonaws.com. (177)
12:26:01.903037 IP 127.0.1.1.53 > 127.0.0.1.56878: 14325 2/0/0 CNAME telemetry-incoming.r53-2.services.mozilla.com., CNAME pipeline-edge-prod-25-561439127.us-west-2.elb.amazonaws.com. (177)
12:26:01.908341 IP 192.168.0.1.53 > 10.0.2.15.6653: 52562 10/0/0 CNAME telemetry-incoming.r53-2.services.mozilla.com., CNAME pipeline-edge-prod-25-561439127.us-west-2.elb.amazonaws.com., A 52.34.167.99, A 54.191.241.246, A 52.89.179.237, A 52.38.149.111, A 52.34.248.21, A 35.167.70.180, A 52.26.72.3, A 52.36.71.24 (305)
12:26:01.908417 IP 127.0.1.1.53 > 127.0.0.1.56878: 48566 10/0/0 CNAME telemetry-incoming.r53-2.services.mozilla.com., CNAME pipeline-edge-prod-25-561439127.us-west-2.elb.amazonaws.com., A 52.34.167.99, A 54.191.241.246, A 52.89.179.237, A 52.38.149.111, A 52.34.248.21, A 35.167.70.180, A 52.26.72.3, A 52.36.71.24 (305)
12:26:01.908630 IP 10.0.2.15.39770 > 52.34.167.99.443: Flags [S], seq 1389755205, win 29200, options [mss 1460,sackOK,TS val 6409863 ecr 0,nop,wscale 7], length 0
12:26:02.161365 IP 10.0.2.15.39772 > 52.34.167.99.443: Flags [S], seq 1462915490, win 29200, options [mss 1460,sackOK,TS val 6409927 ecr 0,nop,wscale 7], length 0
12:26:02.165710 IP 52.34.167.99.443 > 10.0.2.15.39770: Flags [S.], seq 431168001, ack 1389755206, win 65535, options [mss 1460], length 0
12:26:02.165793 IP 10.0.2.15.39770 > 52.34.167.99.443: Flags [.], ack 1, win 29200, length 0
12:26:02.166593 IP 10.0.2.15.39770 > 52.34.167.99.443: Flags [P.], seq 1:205, ack 1, win 29200, length 204
12:26:02.167219 IP 52.34.167.99.443 > 10.0.2.15.39770: Flags [.], ack 205, win 65535, length 0
12:26:02.423297 IP 52.34.167.99.443 > 10.0.2.15.39770: Flags [.], seq 1:2841, ack 205, win 65535, length 2840
12:26:02.423320 IP 10.0.2.15.39770 > 52.34.167.99.443: Flags [.], ack 2841, win 34080, length 0
12:26:02.423805 IP 52.34.167.99.443 > 10.0.2.15.39770: Flags [P.], seq 2841:3404, ack 205, win 65535, length 563
12:26:02.423821 IP 10.0.2.15.39770 > 52.34.167.99.443: Flags [.], ack 3404, win 36920, length 0
12:26:02.445128 IP 10.0.2.15.39770 > 52.34.167.99.443: Flags [P.], seq 205:331, ack 3404, win 36920, length 126
12:26:02.445918 IP 52.34.167.99.443 > 10.0.2.15.39770: Flags [.], ack 331, win 65535, length 0
12:26:02.446347 IP 10.0.2.15.44528 > 117.18.237.29.80: Flags [P.], seq 879:1318, ack 1577, win 32308, length 439: HTTP: POST / HTTP/1.1
12:26:02.447006 IP 117.18.237.29.80 > 10.0.2.15.44528: Flags [.], ack 1318, win 65535, length 0
12:26:02.454929 IP 52.34.167.99.443 > 10.0.2.15.39772: Flags [S.], seq 431232001, ack 1462915491, win 65535, options [mss 1460], length 0
12:26:02.454976 IP 10.0.2.15.39772 > 52.34.167.99.443: Flags [.], ack 1, win 29200, length 0
12:26:02.455723 IP 10.0.2.15.39772 > 52.34.167.99.443: Flags [P.], seq 1:205, ack 1, win 29200, length 204
12:26:02.456339 IP 52.34.167.99.443 > 10.0.2.15.39772: Flags [.], ack 205, win 65535, length 0
12:26:02.628476 IP 117.18.237.29.80 > 10.0.2.15.44528: Flags [P.], seq 1577:2365, ack 1318, win 65535, length 788: HTTP: HTTP/1.1 200 OK
12:26:02.628498 IP 10.0.2.15.44528 > 117.18.237.29.80: Flags [.], ack 2365, win 33884, length 0
12:26:02.629613 IP 10.0.2.15.39770 > 52.34.167.99.443: Flags [.], seq 331:3251, ack 3404, win 36920, length 2920
12:26:02.629708 IP 10.0.2.15.39770 > 52.34.167.99.443: Flags [P.], seq 3251:3819, ack 3404, win 36920, length 568
12:26:02.629843 IP 52.34.167.99.443 > 10.0.2.15.39770: Flags [.], ack 1791, win 65535, length 0
12:26:02.629895 IP 52.34.167.99.443 > 10.0.2.15.39770: Flags [.], ack 3251, win 65535, length 0
12:26:02.629898 IP 52.34.167.99.443 > 10.0.2.15.39770: Flags [.], ack 3819, win 65535, length 0
12:26:02.688634 IP 52.34.167.99.443 > 10.0.2.15.39770: Flags [P.], seq 3404:3455, ack 3819, win 65535, length 51
12:26:02.725399 IP 10.0.2.15.39770 > 52.34.167.99.443: Flags [.], ack 3455, win 36920, length 0
12:26:02.747056 IP 52.34.167.99.443 > 10.0.2.15.39772: Flags [.], seq 1:2841, ack 205, win 65535, length 2840
12:26:02.747068 IP 10.0.2.15.39772 > 52.34.167.99.443: Flags [.], ack 2841, win 34080, length 0
12:26:02.747265 IP 52.34.167.99.443 > 10.0.2.15.39772: Flags [P.], seq 2841:3404, ack 205, win 65535, length 563
12:26:02.747269 IP 10.0.2.15.39772 > 52.34.167.99.443: Flags [.], ack 3404, win 36920, length 0
12:26:02.749700 IP 10.0.2.15.39772 > 52.34.167.99.443: Flags [P.], seq 205:331, ack 3404, win 36920, length 126
12:26:02.749954 IP 52.34.167.99.443 > 10.0.2.15.39772: Flags [.], ack 331, win 65535, length 0
12:26:02.750795 IP 10.0.2.15.39772 > 52.34.167.99.443: Flags [.], seq 331:3251, ack 3404, win 36920, length 2920
12:26:02.750883 IP 10.0.2.15.39772 > 52.34.167.99.443: Flags [P.], seq 3251:3800, ack 3404, win 36920, length 549
12:26:02.750989 IP 52.34.167.99.443 > 10.0.2.15.39772: Flags [.], ack 1791, win 65535, length 0
12:26:02.751070 IP 52.34.167.99.443 > 10.0.2.15.39772: Flags [.], ack 3251, win 65535, length 0
12:26:02.751074 IP 52.34.167.99.443 > 10.0.2.15.39772: Flags [.], ack 3800, win 65535, length 0
12:26:02.935419 IP 52.34.167.99.443 > 10.0.2.15.39770: Flags [P.], seq 3455:3611, ack 3819, win 65535, length 156
12:26:02.935444 IP 10.0.2.15.39770 > 52.34.167.99.443: Flags [.], ack 3611, win 39760, length 0
12:26:02.936028 IP 10.0.2.15.39770 > 52.34.167.99.443: Flags [.], seq 3819:6739, ack 3611, win 39760, length 2920
12:26:02.936248 IP 10.0.2.15.39770 > 52.34.167.99.443: Flags [P.], seq 6739:7356, ack 3611, win 39760, length 617
12:26:02.936638 IP 52.34.167.99.443 > 10.0.2.15.39770: Flags [.], ack 5279, win 65535, length 0
12:26:02.936655 IP 52.34.167.99.443 > 10.0.2.15.39770: Flags [.], ack 6739, win 65535, length 0
12:26:02.936961 IP 52.34.167.99.443 > 10.0.2.15.39770: Flags [.], ack 7356, win 65535, length 0
12:26:03.139651 IP 52.34.167.99.443 > 10.0.2.15.39772: Flags [P.], seq 3404:3611, ack 3800, win 65535, length 207
12:26:03.177918 IP 10.0.2.15.39772 > 52.34.167.99.443: Flags [.], ack 3611, win 39760, length 0
12:26:03.218717 IP 52.34.167.99.443 > 10.0.2.15.39770: Flags [P.], seq 3611:3767, ack 7356, win 65535, length 156
12:26:03.257092 IP 10.0.2.15.39770 > 52.34.167.99.443: Flags [.], ack 3767, win 42600, length 0
12:26:08.629518 IP 10.0.2.15.42452 > 52.39.131.77.443: Flags [.], ack 3506, win 42600, length 0
12:26:08.629698 IP 52.39.131.77.443 > 10.0.2.15.42452: Flags [.], ack 1231, win 65535, length 0
12:26:08.678560 IP 10.0.2.15.41740 > 52.84.49.4.443: Flags [P.], seq 519:565, ack 4201, win 39760, length 46
12:26:08.679015 IP 52.84.49.4.443 > 10.0.2.15.41740: Flags [.], ack 565, win 65535, length 0
12:26:08.773396 IP 52.84.49.4.443 > 10.0.2.15.41740: Flags [P.], seq 4201:4247, ack 565, win 65535, length 46
12:26:08.789399 IP 10.0.2.15.60522 > 69.171.245.53.443: Flags [S], seq 498341899, win 29200, options [mss 1460,sackOK,TS val 6411584 ecr 0,nop,wscale 7], length 0
12:26:08.817125 IP 10.0.2.15.41740 > 52.84.49.4.443: Flags [.], ack 4247, win 39760, length 0
12:26:09.045622 IP 10.0.2.15.60524 > 69.171.245.53.443: Flags [S], seq 2911818185, win 29200, options [mss 1460,sackOK,TS val 6411648 ecr 0,nop,wscale 7], length 0
12:26:12.633275 IP 10.0.2.15.44528 > 117.18.237.29.80: Flags [.], ack 2365, win 33884, length 0
12:26:12.633845 IP 117.18.237.29.80 > 10.0.2.15.44528: Flags [.], ack 1318, win 65535, length 0
12:26:13.137463 IP 10.0.2.15.39772 > 52.34.167.99.443: Flags [.], ack 3611, win 39760, length 0
12:26:13.137805 IP 52.34.167.99.443 > 10.0.2.15.39772: Flags [.], ack 3800, win 65535, length 0
12:26:13.221321 IP 10.0.2.15.39770 > 52.34.167.99.443: Flags [.], ack 3767, win 42600, length 0
12:26:13.221625 IP 52.34.167.99.443 > 10.0.2.15.39770: Flags [.], ack 7356, win 65535, length 0
12:26:18.645104 IP 10.0.2.15.42452 > 52.39.131.77.443: Flags [.], ack 3506, win 42600, length 0
12:26:18.645312 IP 52.39.131.77.443 > 10.0.2.15.42452: Flags [.], ack 1231, win 65535, length 0
12:26:22.645154 IP 10.0.2.15.44528 > 117.18.237.29.80: Flags [.], ack 2365, win 33884, length 0
12:26:22.645637 IP 117.18.237.29.80 > 10.0.2.15.44528: Flags [.], ack 1318, win 65535, length 0
12:26:23.157524 IP 10.0.2.15.39772 > 52.34.167.99.443: Flags [.], ack 3611, win 39760, length 0
12:26:23.157992 IP 52.34.167.99.443 > 10.0.2.15.39772: Flags [.], ack 3800, win 65535, length 0
12:26:23.253154 IP 10.0.2.15.39770 > 52.34.167.99.443: Flags [.], ack 3767, win 42600, length 0
12:26:23.253634 IP 52.34.167.99.443 > 10.0.2.15.39770: Flags [.], ack 7356, win 65535, length 0
12:26:28.015781 IP 10.0.2.15.39772 > 52.34.167.99.443: Flags [P.], seq 3800:3831, ack 3611, win 39760, length 31
12:26:28.015860 IP 10.0.2.15.39772 > 52.34.167.99.443: Flags [F.], seq 3831, ack 3611, win 39760, length 0
12:26:28.015984 IP 10.0.2.15.39770 > 52.34.167.99.443: Flags [P.], seq 7356:7387, ack 3767, win 42600, length 31
12:26:28.016110 IP 52.34.167.99.443 > 10.0.2.15.39772: Flags [.], ack 3831, win 65535, length 0
12:26:28.016117 IP 52.34.167.99.443 > 10.0.2.15.39772: Flags [.], ack 3832, win 65535, length 0
12:26:28.016149 IP 10.0.2.15.39770 > 52.34.167.99.443: Flags [F.], seq 7387, ack 3767, win 42600, length 0
12:26:28.016182 IP 52.34.167.99.443 > 10.0.2.15.39770: Flags [.], ack 7387, win 65535, length 0
12:26:28.016258 IP 52.34.167.99.443 > 10.0.2.15.39770: Flags [.], ack 7388, win 65535, length 0
12:26:28.016325 IP 10.0.2.15.44528 > 117.18.237.29.80: Flags [F.], seq 1318, ack 2365, win 33884, length 0
12:26:28.016386 IP 10.0.2.15.42452 > 52.39.131.77.443: Flags [P.], seq 1231:1262, ack 3506, win 42600, length 31
12:26:28.016429 IP 10.0.2.15.42452 > 52.39.131.77.443: Flags [F.], seq 1262, ack 3506, win 42600, length 0
12:26:28.016460 IP 117.18.237.29.80 > 10.0.2.15.44528: Flags [.], ack 1319, win 65535, length 0
12:26:28.016473 IP 52.39.131.77.443 > 10.0.2.15.42452: Flags [.], ack 1262, win 65535, length 0
12:26:28.016474 IP 52.39.131.77.443 > 10.0.2.15.42452: Flags [.], ack 1263, win 65535, length 0
12:26:28.016660 IP 10.0.2.15.41740 > 52.84.49.4.443: Flags [P.], seq 565:596, ack 4247, win 39760, length 31
12:26:28.016707 IP 10.0.2.15.41740 > 52.84.49.4.443: Flags [F.], seq 596, ack 4247, win 39760, length 0
12:26:28.016795 IP 52.84.49.4.443 > 10.0.2.15.41740: Flags [.], ack 596, win 65535, length 0
12:26:28.016798 IP 52.84.49.4.443 > 10.0.2.15.41740: Flags [.], ack 597, win 65535, length 0
12:26:28.126945 IP 117.18.237.29.80 > 10.0.2.15.44528: Flags [F.], seq 2365, ack 1319, win 65535, length 0
12:26:28.126969 IP 10.0.2.15.44528 > 117.18.237.29.80: Flags [.], ack 2366, win 33884, length 0
12:26:28.127086 IP 52.84.49.4.443 > 10.0.2.15.41740: Flags [F.], seq 4247, ack 597, win 65535, length 0
12:26:28.127091 IP 10.0.2.15.41740 > 52.84.49.4.443: Flags [.], ack 4248, win 39760, length 0
12:26:28.331393 IP 52.34.167.99.443 > 10.0.2.15.39770: Flags [P.], seq 3767:3798, ack 7388, win 65535, length 31
12:26:28.331418 IP 10.0.2.15.39770 > 52.34.167.99.443: Flags [R], seq 1389762593, win 0, length 0
12:26:28.331502 IP 52.34.167.99.443 > 10.0.2.15.39770: Flags [F.], seq 3798, ack 7388, win 65535, length 0
12:26:28.331549 IP 10.0.2.15.39770 > 52.34.167.99.443: Flags [R], seq 1389762593, win 0, length 0
12:26:28.331601 IP 52.39.131.77.443 > 10.0.2.15.42452: Flags [P.], seq 3506:3537, ack 1263, win 65535, length 31
12:26:28.331609 IP 10.0.2.15.42452 > 52.39.131.77.443: Flags [R], seq 1618351085, win 0, length 0
12:26:28.331656 IP 52.34.167.99.443 > 10.0.2.15.39772: Flags [P.], seq 3611:3642, ack 3832, win 65535, length 31
12:26:28.331663 IP 10.0.2.15.39772 > 52.34.167.99.443: Flags [R], seq 1462919322, win 0, length 0
12:26:28.331703 IP 52.34.167.99.443 > 10.0.2.15.39772: Flags [F.], seq 3642, ack 3832, win 65535, length 0
12:26:28.331709 IP 10.0.2.15.39772 > 52.34.167.99.443: Flags [R], seq 1462919322, win 0, length 0
12:26:28.331749 IP 52.39.131.77.443 > 10.0.2.15.42452: Flags [F.], seq 3537, ack 1263, win 65535, length 0
12:26:28.331755 IP 10.0.2.15.42452 > 52.39.131.77.443: Flags [R], seq 1618351085, win 0, length 0
12:26:28.331795 IP 52.34.167.99.443 > 10.0.2.15.39770: Flags [R.], seq 3863799295, ack 7388, win 0, length 0
12:26:28.331928 IP 52.34.167.99.443 > 10.0.2.15.39772: Flags [R.], seq 3863735295, ack 3832, win 0, length 0
12:26:28.331933 IP 52.39.131.77.443 > 10.0.2.15.42452: Flags [R.], seq 3865911295, ack 1263, win 0, length 0
12:26:31.662961 IP 127.0.0.1.59452 > 127.0.1.1.53: 17731+ A? www.mozilla.org. (33)
12:26:31.662969 IP 127.0.0.1.59452 > 127.0.1.1.53: 20593+ AAAA? www.mozilla.org. (33)
12:26:31.663022 IP 10.0.2.15.39033 > 192.168.1.1.53: 17919+ A? www.mozilla.org. (33)
12:26:31.663098 IP 10.0.2.15.39033 > 192.168.0.1.53: 17919+ A? www.mozilla.org. (33)
12:26:31.663156 IP 10.0.2.15.16425 > 192.168.0.1.53: 12811+ AAAA? www.mozilla.org. (33)
12:26:31.678774 IP 192.168.1.1.53 > 10.0.2.15.39033: 17919 3/0/0 CNAME www.mozilla.org.cdn.cloudflare.net., A 104.16.40.2, A 104.16.41.2 (113)
12:26:31.678839 IP 127.0.1.1.53 > 127.0.0.1.59452: 17731 3/0/0 CNAME www.mozilla.org.cdn.cloudflare.net., A 104.16.40.2, A 104.16.41.2 (113)
12:26:31.683676 IP 192.168.0.1.53 > 10.0.2.15.16425: 12811 3/0/0 CNAME www.mozilla.org.cdn.cloudflare.net., AAAA 2606:4700::6810:2902, AAAA 2606:4700::6810:2802 (137)
12:26:31.683687 IP 192.168.0.1.53 > 10.0.2.15.39033: 17919 3/0/0 CNAME www.mozilla.org.cdn.cloudflare.net., A 104.16.41.2, A 104.16.40.2 (113)
12:26:31.683700 IP 10.0.2.15 > 192.168.0.1: ICMP 10.0.2.15 udp port 39033 unreachable, length 149
12:26:31.683778 IP 127.0.1.1.53 > 127.0.0.1.59452: 20593 3/0/0 CNAME www.mozilla.org.cdn.cloudflare.net., AAAA 2606:4700::6810:2902, AAAA 2606:4700::6810:2802 (137)
12:26:32.402604 IP 127.0.0.1.49407 > 127.0.1.1.53: 26331+ A? www.google.com. (32)
12:26:32.402635 IP 10.0.2.15.45647 > 192.168.0.1.53: 49190+ A? www.google.com. (32)
12:26:32.402709 IP 127.0.0.1.49407 > 127.0.1.1.53: 22603+ AAAA? www.google.com. (32)
12:26:32.402724 IP 10.0.2.15.8008 > 192.168.0.1.53: 711+ AAAA? www.google.com. (32)
12:26:32.408824 IP 192.168.0.1.53 > 10.0.2.15.8008: 711 1/0/0 AAAA 2404:6800:4008:801::2004 (60)
12:26:32.408887 IP 127.0.1.1.53 > 127.0.0.1.49407: 22603 1/0/0 AAAA 2404:6800:4008:801::2004 (60)
12:26:32.424829 IP 192.168.0.1.53 > 10.0.2.15.45647: 49190 1/0/0 A 69.171.245.49 (48)
12:26:32.424941 IP 127.0.1.1.53 > 127.0.0.1.49407: 26331 1/0/0 A 69.171.245.49 (48)
12:26:32.431440 IP 10.0.2.15.48984 > 69.171.245.49.443: Flags [S], seq 415651522, win 29200, options [mss 1460,sackOK,TS val 6417494 ecr 0,nop,wscale 7], length 0
12:26:32.682529 IP 10.0.2.15.48986 > 69.171.245.49.443: Flags [S], seq 815772755, win 29200, options [mss 1460,sackOK,TS val 6417557 ecr 0,nop,wscale 7], length 0
12:26:33.429483 IP 10.0.2.15.48984 > 69.171.245.49.443: Flags [S], seq 415651522, win 29200, options [mss 1460,sackOK,TS val 6417744 ecr 0,nop,wscale 7], length 0
12:26:33.681367 IP 10.0.2.15.48986 > 69.171.245.49.443: Flags [S], seq 815772755, win 29200, options [mss 1460,sackOK,TS val 6417807 ecr 0,nop,wscale 7], length 0
12:26:35.443848 IP 10.0.2.15.48984 > 69.171.245.49.443: Flags [S], seq 415651522, win 29200, options [mss 1460,sackOK,TS val 6418247 ecr 0,nop,wscale 7], length 0
12:26:35.685364 IP 10.0.2.15.48986 > 69.171.245.49.443: Flags [S], seq 815772755, win 29200, options [mss 1460,sackOK,TS val 6418308 ecr 0,nop,wscale 7], length 0
12:26:36.800332 IP 127.0.0.1.47061 > 127.0.1.1.53: 468+ A? self-repair.mozilla.org. (41)
12:26:36.800396 IP 10.0.2.15.3224 > 192.168.0.1.53: 30730+ A? self-repair.mozilla.org. (41)
12:26:36.800632 IP 127.0.0.1.47061 > 127.0.1.1.53: 3689+ AAAA? self-repair.mozilla.org. (41)
12:26:36.800677 IP 10.0.2.15.57713 > 192.168.0.1.53: 11414+ AAAA? self-repair.mozilla.org. (41)
12:26:36.817618 IP 192.168.0.1.53 > 10.0.2.15.57713: 11414 10/0/0 CNAME self-repair.r53-2.services.mozilla.com., CNAME d39fl7ga3npck8.cloudfront.net., AAAA 2600:9000:204b:b600:13:9d43:b600:93a1, AAAA 2600:9000:204b:7600:13:9d43:b600:93a1, AAAA 2600:9000:204b:2600:13:9d43:b600:93a1, AAAA 2600:9000:204b:c200:13:9d43:b600:93a1, AAAA 2600:9000:204b:8600:13:9d43:b600:93a1, AAAA 2600:9000:204b:b800:13:9d43:b600:93a1, AAAA 2600:9000:204b:a800:13:9d43:b600:93a1, AAAA 2600:9000:204b:9e00:13:9d43:b600:93a1 (360)
12:26:36.817634 IP 192.168.0.1.53 > 10.0.2.15.3224: 30730 6/0/0 CNAME self-repair.r53-2.services.mozilla.com., CNAME d39fl7ga3npck8.cloudfront.net., A 52.84.49.151, A 52.84.49.184, A 52.84.49.139, A 52.84.49.4 (200)
12:26:36.817752 IP 127.0.1.1.53 > 127.0.0.1.47061: 468 6/0/0 CNAME self-repair.r53-2.services.mozilla.com., CNAME d39fl7ga3npck8.cloudfront.net., A 52.84.49.151, A 52.84.49.184, A 52.84.49.139, A 52.84.49.4 (200)
12:26:36.817787 IP 127.0.1.1.53 > 127.0.0.1.47061: 3689 10/0/0 CNAME self-repair.r53-2.services.mozilla.com., CNAME d39fl7ga3npck8.cloudfront.net., AAAA 2600:9000:204b:b600:13:9d43:b600:93a1, AAAA 2600:9000:204b:7600:13:9d43:b600:93a1, AAAA 2600:9000:204b:2600:13:9d43:b600:93a1, AAAA 2600:9000:204b:c200:13:9d43:b600:93a1, AAAA 2600:9000:204b:8600:13:9d43:b600:93a1, AAAA 2600:9000:204b:b800:13:9d43:b600:93a1, AAAA 2600:9000:204b:a800:13:9d43:b600:93a1, AAAA 2600:9000:204b:9e00:13:9d43:b600:93a1 (360)
12:26:36.818349 IP 10.0.2.15.56726 > 52.84.49.151.443: Flags [S], seq 1981315286, win 29200, options [mss 1460,sackOK,TS val 6418591 ecr 0,nop,wscale 7], length 0
12:26:36.932631 IP 52.84.49.151.443 > 10.0.2.15.56726: Flags [S.], seq 435136001, ack 1981315287, win 65535, options [mss 1460], length 0
12:26:36.932673 IP 10.0.2.15.56726 > 52.84.49.151.443: Flags [.], ack 1, win 29200, length 0
12:26:36.933801 IP 10.0.2.15.56726 > 52.84.49.151.443: Flags [P.], seq 1:198, ack 1, win 29200, length 197
12:26:36.934316 IP 52.84.49.151.443 > 10.0.2.15.56726: Flags [.], ack 198, win 65535, length 0
12:26:37.035032 IP 52.84.49.151.443 > 10.0.2.15.56726: Flags [.], seq 1:2841, ack 198, win 65535, length 2840
12:26:37.035053 IP 10.0.2.15.56726 > 52.84.49.151.443: Flags [.], ack 2841, win 34080, length 0
12:26:37.035299 IP 52.84.49.151.443 > 10.0.2.15.56726: Flags [P.], seq 2841:3852, ack 198, win 65535, length 1011
12:26:37.035313 IP 10.0.2.15.56726 > 52.84.49.151.443: Flags [.], ack 3852, win 36920, length 0
